{
  "observation_contract_version": "RAW-OBS-V0",
  "observations": [
    {
      "adapter_version": "devostasis.github.v1",
      "collected_at": "2026-09-05T12:00:00Z",
      "coverage": null,
      "evidence_ref": {
        "example": true
      },
      "freshness": "FRESH",
      "notes": null,
      "observation_id": "ci.configured",
      "provider": "github",
      "reason_code": null,
      "schema_version": "RAW-OBS-V0",
      "source_ref": "example:ci.configured",
      "status": "AVAILABLE",
      "value": true,
      "value_type": "boolean"
    },
    {
      "adapter_version": "devostasis.ci-history.v2",
      "collected_at": "2026-09-05T12:00:00Z",
      "coverage": null,
      "evidence_ref": null,
      "freshness": "FRESH",
      "notes": null,
      "observation_id": "ci.revision_history_carried",
      "provider": "history",
      "reason_code": "NO_PREVIOUS_BUNDLE",
      "schema_version": "RAW-OBS-V0",
      "source_ref": "store:none",
      "status": "UNAVAILABLE",
      "value": null,
      "value_type": "record"
    },
    {
      "adapter_version": "devostasis.github.v1",
      "collected_at": "2026-09-05T12:00:00Z",
      "coverage": {
        "attempts_complete": true,
        "outcome_map_version": "devostasis.ci-outcomes.github.v1",
        "runs_complete": true,
        "surface": "github_actions",
        "window_end": "2026-09-05T12:00:00Z",
        "window_start": "2026-08-22T12:00:00Z"
      },
      "evidence_ref": {
        "example": true
      },
      "freshness": "FRESH",
      "notes": null,
      "observation_id": "ci.revision_verdicts_14d",
      "provider": "github",
      "reason_code": null,
      "schema_version": "RAW-OBS-V0",
      "source_ref": "example:ci.revision_verdicts_14d",
      "status": "AVAILABLE",
      "value": [
        {
          "committed_at": "2026-08-22T09:00:00Z",
          "current_verdict": "VERIFY_PASS",
          "historical_contribution": "VERIFY_PASS",
          "history_complete": true,
          "history_provenance": "ATTEMPT_LEVEL",
          "history_state": "PASS_ONLY_OBSERVED",
          "parents": [
            {
              "attempts_complete": true,
              "attempts_observed": [
                {
                  "attempt": 1,
                  "state": "VERIFY_PASS"
                }
              ],
              "current_attempt": 1,
              "current_state": "VERIFY_PASS",
              "event": "push",
              "history_state": "PASS_ONLY_OBSERVED",
              "kind": "github_actions_workflow_run",
              "name": "CI",
              "parent_id": "github_actions:workflow_run:900",
              "url": "https://example.invalid/actions/runs/900"
            }
          ],
          "revision": "000000000000000000000000000000000000000c"
        },
        {
          "committed_at": "2026-08-23T09:00:00Z",
          "current_verdict": "VERIFY_PASS",
          "historical_contribution": "VERIFY_PASS",
          "history_complete": true,
          "history_provenance": "ATTEMPT_LEVEL",
          "history_state": "PASS_ONLY_OBSERVED",
          "parents": [
            {
              "attempts_complete": true,
              "attempts_observed": [
                {
                  "attempt": 1,
                  "state": "VERIFY_PASS"
                }
              ],
              "current_attempt": 1,
              "current_state": "VERIFY_PASS",
              "event": "push",
              "history_state": "PASS_ONLY_OBSERVED",
              "kind": "github_actions_workflow_run",
              "name": "CI",
              "parent_id": "github_actions:workflow_run:901",
              "url": "https://example.invalid/actions/runs/900"
            }
          ],
          "revision": "000000000000000000000000000000000000000d"
        },
        {
          "committed_at": "2026-08-24T09:00:00Z",
          "current_verdict": "VERIFY_PASS",
          "historical_contribution": "VERIFY_PASS",
          "history_complete": true,
          "history_provenance": "ATTEMPT_LEVEL",
          "history_state": "PASS_ONLY_OBSERVED",
          "parents": [
            {
              "attempts_complete": true,
              "attempts_observed": [
                {
                  "attempt": 1,
                  "state": "VERIFY_PASS"
                }
              ],
              "current_attempt": 1,
              "current_state": "VERIFY_PASS",
              "event": "push",
              "history_state": "PASS_ONLY_OBSERVED",
              "kind": "github_actions_workflow_run",
              "name": "CI",
              "parent_id": "github_actions:workflow_run:902",
              "url": "https://example.invalid/actions/runs/900"
            }
          ],
          "revision": "000000000000000000000000000000000000000e"
        },
        {
          "committed_at": "2026-08-25T09:00:00Z",
          "current_verdict": "VERIFY_PASS",
          "historical_contribution": "VERIFY_FAIL",
          "history_complete": true,
          "history_provenance": "ATTEMPT_LEVEL",
          "history_state": "FAILURE_OBSERVED",
          "parents": [
            {
              "attempts_complete": true,
              "attempts_observed": [
                {
                  "attempt": 1,
                  "state": "VERIFY_FAIL"
                },
                {
                  "attempt": 2,
                  "state": "VERIFY_PASS"
                }
              ],
              "current_attempt": 2,
              "current_state": "VERIFY_PASS",
              "event": "push",
              "history_state": "FAILURE_OBSERVED",
              "kind": "github_actions_workflow_run",
              "name": "CI",
              "parent_id": "github_actions:workflow_run:903",
              "url": "https://example.invalid/actions/runs/900"
            }
          ],
          "revision": "000000000000000000000000000000000000000f"
        },
        {
          "committed_at": "2026-08-26T09:00:00Z",
          "current_verdict": "VERIFY_PASS",
          "historical_contribution": "VERIFY_PASS",
          "history_complete": true,
          "history_provenance": "ATTEMPT_LEVEL",
          "history_state": "PASS_ONLY_OBSERVED",
          "parents": [
            {
              "attempts_complete": true,
              "attempts_observed": [
                {
                  "attempt": 1,
                  "state": "VERIFY_PASS"
                }
              ],
              "current_attempt": 1,
              "current_state": "VERIFY_PASS",
              "event": "push",
              "history_state": "PASS_ONLY_OBSERVED",
              "kind": "github_actions_workflow_run",
              "name": "CI",
              "parent_id": "github_actions:workflow_run:904",
              "url": "https://example.invalid/actions/runs/900"
            }
          ],
          "revision": "0000000000000000000000000000000000000010"
        },
        {
          "committed_at": "2026-08-27T09:00:00Z",
          "current_verdict": "VERIFY_PASS",
          "historical_contribution": "VERIFY_PASS",
          "history_complete": true,
          "history_provenance": "ATTEMPT_LEVEL",
          "history_state": "PASS_ONLY_OBSERVED",
          "parents": [
            {
              "attempts_complete": true,
              "attempts_observed": [
                {
                  "attempt": 1,
                  "state": "VERIFY_PASS"
                }
              ],
              "current_attempt": 1,
              "current_state": "VERIFY_PASS",
              "event": "push",
              "history_state": "PASS_ONLY_OBSERVED",
              "kind": "github_actions_workflow_run",
              "name": "CI",
              "parent_id": "github_actions:workflow_run:905",
              "url": "https://example.invalid/actions/runs/900"
            }
          ],
          "revision": "0000000000000000000000000000000000000011"
        },
        {
          "committed_at": "2026-08-28T09:00:00Z",
          "current_verdict": "VERIFY_PASS",
          "historical_contribution": "VERIFY_PASS",
          "history_complete": true,
          "history_provenance": "ATTEMPT_LEVEL",
          "history_state": "PASS_ONLY_OBSERVED",
          "parents": [
            {
              "attempts_complete": true,
              "attempts_observed": [
                {
                  "attempt": 1,
                  "state": "VERIFY_PASS"
                }
              ],
              "current_attempt": 1,
              "current_state": "VERIFY_PASS",
              "event": "push",
              "history_state": "PASS_ONLY_OBSERVED",
              "kind": "github_actions_workflow_run",
              "name": "CI",
              "parent_id": "github_actions:workflow_run:906",
              "url": "https://example.invalid/actions/runs/900"
            }
          ],
          "revision": "0000000000000000000000000000000000000012"
        },
        {
          "committed_at": "2026-08-29T09:00:00Z",
          "current_verdict": "VERIFY_PASS",
          "historical_contribution": "VERIFY_PASS",
          "history_complete": true,
          "history_provenance": "ATTEMPT_LEVEL",
          "history_state": "PASS_ONLY_OBSERVED",
          "parents": [
            {
              "attempts_complete": true,
              "attempts_observed": [
                {
                  "attempt": 1,
                  "state": "VERIFY_PASS"
                }
              ],
              "current_attempt": 1,
              "current_state": "VERIFY_PASS",
              "event": "push",
              "history_state": "PASS_ONLY_OBSERVED",
              "kind": "github_actions_workflow_run",
              "name": "CI",
              "parent_id": "github_actions:workflow_run:907",
              "url": "https://example.invalid/actions/runs/900"
            }
          ],
          "revision": "0000000000000000000000000000000000000013"
        }
      ],